{
  "schema_version": "country_outage_trend_analysis_s0_v1",
  "baseline_id": "trend_s0_effect_and_value_baseline_v1",
  "stage": "S0",
  "status": "design_baseline_not_implementation_evidence",
  "effect_contract": {
    "acceptance_path": "docs/国家中断趋势分析最终验收文档.md",
    "acceptance_sha256": "fa970df01a13a3b01061a84ef0967200ad7274f1bbf92812abc5ea934b3b72e2",
    "plan_path": "docs/国家中断趋势分析分阶段计划.md",
    "plan_sha256": "e92a5176608c7094abccf094ecc85b77cd9d45c1f81f4a272d0f6b140d8b7505",
    "contract_commit": "223323a66940f51a58c02e285074103a65b9979d"
  },
  "boundaries": {
    "collector": "rrc25",
    "collector_count": 1,
    "observation_scope": "bgp_control_plane",
    "snapshot_mode": "fixed_read_only",
    "prohibited_capabilities": [
      "multi_collector",
      "external_evidence",
      "hypothesis_generation",
      "investigation_graph",
      "network_rca",
      "database_rebuild",
      "backend_core_modification",
      "production_switch"
    ],
    "prohibited_claims": [
      "national_internet_outage",
      "user_impact",
      "service_impact",
      "attack",
      "cause",
      "policy_action",
      "responsibility",
      "post_window_full_recovery"
    ]
  },
  "vocabulary": {
    "baseline_types": [
      "fixed_cohort",
      "window_start",
      "contemporaneous_reference",
      "unavailable"
    ],
    "quality_states": [
      "complete",
      "degraded",
      "unavailable"
    ],
    "slot_states": [
      "observed",
      "missing",
      "unknown",
      "source_unavailable",
      "processing_gap",
      "not_observed"
    ],
    "pattern_statuses": [
      "matched",
      "mixed",
      "unmatched",
      "insufficient_data"
    ],
    "atomic_states": [
      "stable",
      "rise",
      "decline",
      "abrupt_drop",
      "abrupt_rise",
      "low_plateau",
      "high_volatility",
      "missing",
      "unknown"
    ],
    "asn_states": [
      "fully_visible",
      "partially_visible",
      "fully_invisible",
      "unknown"
    ],
    "statistical_populations": [
      "fixed_prefix_vp",
      "address_family_fixed_prefix_vp",
      "origin_asn",
      "resource_record",
      "update_message",
      "announce_message",
      "withdraw_message",
      "country_projection_origin_asn"
    ],
    "units": [
      "count",
      "ratio",
      "percentage_point",
      "observed_slot",
      "prefix_vp_slot"
    ]
  },
  "capability_inventory": [
    {
      "id": "fixed_snapshot_identity",
      "state": "existing_source",
      "evidence": [
        "agent-sidecar/src/domain/contracts.ts:SnapshotIdentity",
        "agent-sidecar/src/domain/contracts.ts:CountryOutageFactSet"
      ],
      "boundary": "源码合同绑定事件、publication、revision、data_through、RRC25 与最终性；不等于当前生产身份。"
    },
    {
      "id": "observation_series_resource_audit",
      "state": "existing_source",
      "evidence": [
        "agent-sidecar/src/domain/contracts.ts:CountryOutageSeries",
        "agent-sidecar/src/domain/contracts.ts:CountryOutageResourceSeries",
        "agent-sidecar/src/domain/contracts.ts:CountryOutageAudit"
      ],
      "boundary": "现有合同能承载可见性、资源和审计数据，但尚无统一 TrendProfile。"
    },
    {
      "id": "deterministic_derived_facts",
      "state": "existing_source",
      "evidence": [
        "agent-sidecar/src/domain/contracts.ts:DerivedNumericFact",
        "agent-sidecar/src/domain/contracts.ts:CountryOutageKeyVisibilityPoint"
      ],
      "boundary": "已有公式、操作数和关键可见性点结构；未形成最终验收要求的阶段与窗口账本。"
    },
    {
      "id": "bounded_report_qa_download",
      "state": "existing_source",
      "evidence": [
        "docs/国家中断报告与追问AgentA0基线.md"
      ],
      "boundary": "历史候选具备受控报告、追问和下载链路；不得写成趋势候选或当前生产通过。"
    },
    {
      "id": "asn_report_provenance",
      "state": "data_exists_not_productized",
      "evidence": [
        "agent-sidecar/src/domain/contracts.ts:CountryOutageAsnPage",
        "agent-sidecar/src/domain/contracts.ts:FactProvenance.endpoint excludes asns"
      ],
      "boundary": "ASN 分页数据存在，但当前事实来源白名单没有 asns，不能宣称报告已绑定 ASN 证据。"
    },
    {
      "id": "global_replay_projection",
      "state": "data_exists_not_productized",
      "evidence": [
        "docs/data/RRC25伊朗同期全局状态重放S6最终验收报告.md"
      ],
      "boundary": "同期全球重放制品历史已验收，但尚未接入趋势分析制品、页面、报告与追问。"
    },
    {
      "id": "trend_profile",
      "state": "target",
      "evidence": [
        "docs/国家中断趋势分析最终验收文档.md:TAE-01..TAE-11"
      ],
      "boundary": "S1 至 S5 的目标效果，S0 不实现。"
    },
    {
      "id": "evidence_graph_v1",
      "state": "target",
      "evidence": [
        "docs/国家中断趋势分析最终验收文档.md:TAE-12..TAE-14"
      ],
      "boundary": "只允许 Claim、Evidence、Limitation、Unknown 与白名单关系，不含 Hypothesis。"
    },
    {
      "id": "trend_reading_journey_and_operators",
      "state": "target",
      "evidence": [
        "docs/国家中断趋势分析最终验收文档.md:第四节",
        "docs/国家中断趋势分析最终验收文档.md:TAE-14"
      ],
      "boundary": "页面、报告、追问与下载必须共享同一确定性制品。"
    },
    {
      "id": "multi_source_hypothesis_rca",
      "state": "absent_out_of_scope",
      "evidence": [
        "docs/国家中断趋势分析最终验收文档.md:第五节"
      ],
      "boundary": "不增加 DNS、HTTP、Traffic、Probe、Hypothesis 或 Network RCA。"
    },
    {
      "id": "current_production_runtime_identity",
      "state": "runtime_unverified",
      "evidence": [
        "S0不执行发布或现网切换"
      ],
      "boundary": "本阶段不对当前生产版本、运行时制品或现网效果作结论。"
    }
  ],
  "reference_data": [
    {
      "id": "historical_ir_fixed_snapshot",
      "evidence_status": "historical_accepted_artifact",
      "identity": {
        "event_ref": "country_outage/2026-02-27 09:12:32/IR/1/r",
        "country": "IR",
        "incident_id": "incident_go_v1_a1de26f854831330c616a72af21597eb",
        "publication_id": "publication_v1_38bddead083db3f49023c2e1",
        "revision": 1,
        "data_through": "2026-02-28T15:00:00Z",
        "is_final": true,
        "collector": "rrc25",
        "window_timezone": "Asia/Shanghai",
        "window_start": "2026-02-28T18:05:00+08:00",
        "window_end": "2026-02-28T23:00:00+08:00"
      },
      "scale": {
        "expected_slots": 60,
        "available_slots": 60,
        "missing_slots": 0,
        "slot_seconds": 300,
        "origin_asn": 563,
        "fixed_prefix_vp": 384767,
        "ipv4_fixed_prefix_vp": 383804,
        "ipv6_fixed_prefix_vp": 963
      },
      "not_proof_of": [
        "current_production_runtime",
        "trend_analysis_implementation",
        "user_or_service_impact",
        "cause"
      ]
    },
    {
      "id": "historical_rrc25_global_replay",
      "evidence_status": "historical_accepted_artifact",
      "identity": {
        "run_id": "global_run_v1_6427ae1ad52037c83d7ec3bb9b5e7757",
        "dataset_id": "global_dataset_v1_d015e120c2d02d39596af86ea8f8fb7c",
        "revision": "global_replay_r2",
        "collector": "rrc25",
        "data_through": "2026-02-28T15:00:00Z"
      },
      "scale": {
        "country_and_unknown_buckets": 241,
        "state_points": 60,
        "asn_states": 5133600,
        "route_state_rows": 55772687,
        "global_fixed_prefix_vp": 55729118
      },
      "not_proof_of": [
        "current_production_runtime",
        "trend_reference_productization",
        "normal_band",
        "real_incident_for_each_country",
        "collector_failure"
      ]
    }
  ],
  "acceptance_curves": [
    {
      "id": "CURVE-01",
      "type": "single_wave",
      "denominator": 100,
      "slot_seconds": 300,
      "baseline_type": "fixed_cohort",
      "slots": [
        {"index": 0, "offset_seconds": 0, "state": "observed", "value": 100},
        {"index": 1, "offset_seconds": 300, "state": "observed", "value": 100},
        {"index": 2, "offset_seconds": 600, "state": "observed", "value": 99},
        {"index": 3, "offset_seconds": 900, "state": "observed", "value": 82},
        {"index": 4, "offset_seconds": 1200, "state": "observed", "value": 75},
        {"index": 5, "offset_seconds": 1500, "state": "observed", "value": 72},
        {"index": 6, "offset_seconds": 1800, "state": "observed", "value": 72},
        {"index": 7, "offset_seconds": 2100, "state": "observed", "value": 72},
        {"index": 8, "offset_seconds": 2400, "state": "observed", "value": 80},
        {"index": 9, "offset_seconds": 2700, "state": "observed", "value": 84},
        {"index": 10, "offset_seconds": 3000, "state": "observed", "value": 84},
        {"index": 11, "offset_seconds": 3300, "state": "observed", "value": 84}
      ],
      "expected": {
        "quality_status": "complete",
        "pattern_status": "matched",
        "pattern_label": "single_wave_partial_rebound",
        "required_atomic_states": ["stable", "abrupt_drop", "decline", "low_plateau", "rise"],
        "observed_slot_count": 12,
        "non_observed_slot_count": 0,
        "slot_state_counts": {"observed": 12},
        "key_points": {"start_index": 0, "end_index": 11, "extreme_index": 5, "largest_drop_end_index": 3, "largest_recovery_end_index": 8},
        "warnings": []
      }
    },
    {
      "id": "CURVE-02",
      "type": "multi_wave",
      "denominator": 100,
      "slot_seconds": 300,
      "baseline_type": "window_start",
      "slots": [
        {"index": 0, "offset_seconds": 0, "state": "observed", "value": 100},
        {"index": 1, "offset_seconds": 300, "state": "observed", "value": 100},
        {"index": 2, "offset_seconds": 600, "state": "observed", "value": 82},
        {"index": 3, "offset_seconds": 900, "state": "observed", "value": 86},
        {"index": 4, "offset_seconds": 1200, "state": "observed", "value": 86},
        {"index": 5, "offset_seconds": 1500, "state": "observed", "value": 68},
        {"index": 6, "offset_seconds": 1800, "state": "observed", "value": 68},
        {"index": 7, "offset_seconds": 2100, "state": "observed", "value": 74},
        {"index": 8, "offset_seconds": 2400, "state": "observed", "value": 71},
        {"index": 9, "offset_seconds": 2700, "state": "observed", "value": 78},